{"system_generated":{"job_title":"Backend Developer","company_name":"Wevolve","about_role":"We are seeking a skilled Backend Developer to join our fintech platform. You will help build scalable and secure financial applications.","responsibilities":["Write clean, efficient Python code","Build REST APIs using FastAPI","Design and optimize database schemas"],"required_skills":["Python","FastAPI","PostgreSQL"],"preferred_skills":["developers"],"experience":"3–5 years of professional experience","benefits":["Fast-paced startup culture","Flexible working hours","High ownership"],"company_about":"Wevolve is a fast-growing fintech company focused on innovation."},"llm_variants":{"default":{"content":"**Job Description:**\n\n**About the Role:**  \nWe are seeking a skilled Backend Developer to join our fintech platform. In this role, you will contribute to the development of scalable and secure financial applications.\n\n**Responsibilities:**  \n- Write clean, efficient Python code  \n- Build REST APIs using FastAPI  \n- Design and optimize database schemas  \n\n**Required Skills:**  \n- Python  \n- FastAPI  \n- PostgreSQL  \n\n**Preferred Skills:**  \n- Developers  \n\n**Experience:**  \n3–5 years of professional experience  \n\n**Benefits:**  \n- Fast-paced startup culture  \n- Flexible working hours  \n- High ownership  \n\n**Company Overview:**  \nWevolve is a fast-growing fintech company focused on innovation.","readability_score":12.99},"concise":{"content":"**Job Description**\n\n**About the Role:**  \nWe are seeking a skilled Backend Developer to join our fintech platform. You will help build scalable and secure financial applications.\n\n**Responsibilities:**  \n- Write clean, efficient Python code  \n- Build REST APIs using FastAPI  \n- Design and optimize database schemas  \n\n**Required Skills:**  \n- Python  \n- FastAPI  \n- PostgreSQL  \n\n**Preferred Skills:**  \n- Developers  \n\n**Experience:**  \n3–5 years of professional experience  \n\n**Benefits:**  \n- Fast-paced startup culture  \n- Flexible working hours  \n- High ownership  \n\n**Company Overview:**  \nWevolve is a fast-growing fintech company focused on innovation.","readability_score":14.15},"startup":{"content":"**Job Description:**\n\n**About the Role:**\nAre you a talented Backend Developer looking to make a significant impact in the fintech world? If so, we’d love to have you on our team! At Wevolve, you’ll be instrumental in building scalable and secure financial applications that make a difference.\n\n**Responsibilities:**\n- Write clean, efficient Python code that powers our applications\n- Build REST APIs using FastAPI to enhance functionality and user experience\n- Design and optimize database schemas to ensure robust data management\n\n**Required Skills:**\n- Proficiency in Python\n- Experience with FastAPI\n- Strong knowledge of PostgreSQL\n\n**Preferred Skills:**\n- Passion for development and a collaborative spirit\n\n**Experience:**\n3–5 years of professional experience in backend development\n\n**Benefits:**\n- Thrive in a fast-paced startup culture that encourages innovation\n- Enjoy flexible working hours to support your work-life balance\n- Experience high ownership of your projects and contributions\n\n**Company Overview:**\nWevolve is a dynamic and fast-growing fintech company dedicated to pushing the boundaries of innovation. Join us and be part of a team that’s transforming the financial landscape!","readability_score":11.32}}}